<!ELEMENT page (elements)>
<!ELEMENT elements (element+)>	
<!ELEMENT element (links, content)>	
   <!ATTLIST element name CDATA #REQUIRED>
   <!ATTLIST element language CDATA #REQUIRED>
   <!ATTLIST element enabled (true|false) #IMPLIED>
<!ELEMENT links (link*)>	
<!ELEMENT link (target, uuid?, anchor?, query?)>	
   <!ATTLIST link name CDATA #REQUIRED>
   <!ATTLIST link internal (true|false) #REQUIRED>
   <!ATTLIST link type (A|IMG|OBJECT) #REQUIRED>
<!ELEMENT uuid (#PCDATA)>
<!ELEMENT target (#PCDATA)>
<!ELEMENT anchor (#PCDATA)>
<!ELEMENT query (#PCDATA)>
<!ELEMENT content (#PCDATA)>