<?xml version="1.0" encoding="UTF-8"?>
<!DOCTYPE page SYSTEM "http://www.opencms.org/dtd/6.0/xmlpage.dtd">

<page>
	<elements>
		<element name="body" language="en">
			<links>
				<link name="link0" type="IMG" internal="true">
					<target><![CDATA[/sites/default/folder1/image2.gif]]></target>
				</link>
			</links>
			<content><![CDATA[English! Image <img src="${link0}" />]]></content>
		</element>
	</elements>
</page>